{
  "id": "GAME-006-VFX-SPEC",
  "title": "核心玩法 VFX 规格",
  "type": "vfx",
  "owner": "vfx",
  "parent": null,
  "objective": "基于已批准的核心玩法、Art Direction 与技术事件边界，定义合成、连续合成、危险警告、危险解除与 Game Over 的特效触发、时序、层级、表现、资源需求、性能等级和降级策略。",
  "inputs": [
    "deliverables/product/GAME-002-CORE-GAMEPLAY-PRD/CORE_GAMEPLAY_PRD_v0.1.md",
    "project/ART_GUIDE.md",
    "project/ARCHITECTURE.md",
    "agents/vfx/ROLE.md",
    "agents/vfx/CONSTRAINTS.md",
    "rules/artifact_contract.md"
  ],
  "deliverables": [
    "deliverables/vfx/GAME-006-VFX-SPEC/VFX_SPEC_v0.1.md",
    "deliverables/vfx/GAME-006-VFX-SPEC/ART_REVIEW_v0.1.md",
    "deliverables/vfx/GAME-006-VFX-SPEC/DELIVERABLE_v0.1.json"
  ],
  "acceptance": [
    "覆盖单次合成、连续合成、危险警告开始/持续/解除和Game Over等核心触发。",
    "每类特效明确触发事件、持续时间、层级、位置、可打断/叠加行为和资源需求。",
    "表现遵循已批准Art Guide，不能遮挡猫咪碰撞可读性或使用全屏频闪。",
    "给出Web首版性能预算和低端降级策略，不引入大型第三方渲染依赖。",
    "通过Art视觉一致性Review后进入用户审批，不改变玩法数值或技术事件语义。"
  ],
  "dependencies": ["GAME-003-ART-DIRECTION", "GAME-004-CORE-TECH-DESIGN"],
  "status": "DONE",
  "approval": "APPROVAL",
  "notes": [
    "用户于 2026-09-17 明确批准 VFX Spec v0.1，当前版本记为 USER_APPROVED。",
    "VFX使用GameplayEvents作为触发语义，不回写核心玩法状态。",
    "首版以轻量Cocos表现为目标，正式运行资产在用户批准后再制作。"
  ]
}